#name	permalink	crunchbase_url	homepage_url	blog_url	blog_feed_url	twitter_username	category_code	number_of_employees	founded_year	founded_month	founded_day	deadpooled_year	deadpooled_month	deadpooled_day	deadpooled_url	tag_list	alias_list	email_address	phone_number	description	updated_at	overview	total_money_raised
Kyte	kyte	http://www.crunchbase.com/company/kyte	http://www.kyte.com	http://kyte.com/blog	http://feeds.feedburner.com/kyte_blog	kyte	games_video	40	2006	12	1	0	0	0	null	null	null	info@kyte.com		Online & Mobile Video Platform	null	<p>Kyte is the online and mobile video platform for media and entertainment. The Kyte Platform combines the real-time, interactive and community building capabilities of the social web with the analytics, control, and monetization features of professional video platforms, enabling companies to converge online and mobile audiences, build community, and monetize.</p>	$23.4M
KickApps	kickapps	http://www.crunchbase.com/company/kickapps	http://www.kickapps.com	http://kickapps.com/blog	http://www.kickapps.com/blog/feed/	KickApps	enterprise	72	2004	3	1	0	0	0		null	null		(212) 730-4558	Social media applications and widgets	null	<p>KickApps provides on-demand social media applications that enable web publishers and marketers to grow, engage, and monetize online audiences. Its SaaS platform is powered by the first Social Graph Engine for web publishers. The platform includes social networking, user-generated content, programmable video players, drag-and-drop widget building, WidgeAds and other applications that are tightly integrated with Robust Media Moderation, member management and reporting.</p><p>In March 2007 KickApps partnered with <a href="http://www.crunchbase.com/company/youtube" title="YouTube">YouTube</a> by providing KickApps&#8217;s affiliates with the ability to easily pull relevant and compelling video from the YouTube library into their own KickApps-powered networks through the YouTube API. KickApps also added features that allow its affiliates to easily publish video from their networks directly to their YouTube accounts. </p>	$32M
Kaboodle	kaboodle	http://www.crunchbase.com/company/kaboodle	http://www.kaboodle.com	http://blog.kaboodle.com	http://blog.kaboodle.com/kaboodleblog/index.rdf	kaboodle	ecommerce	0	2005	10	1	0	0	0	null	null	null	info@kaboodle-inc.com	408-492-0028		null	<p>Launched in October 2005, Kaboodle offers an easy way to collect information from the web and also search for things you may be interested in.  Kaboodle can be used to collect and share information for shopping, travel, research, or just about anything else.  With over 35,000 users, Kaboodle&#8217;s user base is relatively small, but the site is young and has much room to grow. </p><p>The company has received funding and strong support from such investors as Kanwal Rekhi of Inventus Capital, Junglee founder Ashish Gupta, and co-author of Google&#8217;s early search algorithm research Rajeev Motwani.</p>	$5M
Kwiqq	kwiqq	http://www.crunchbase.com/company/kwiqq	http://www.kwiqq.com	http://blog.kwiqq.com	http://blog.kwiqq.com/feed/	null	web	10	2007	1	15	0	0	0	null	null	null	info@kwiqq.com	+44 1273 704 787	null	null	<p>Kwiqq provides a social networking platform for corporations and entrepreneurs.</p>	$0
Kiptronic	kiptronic	http://www.crunchbase.com/company/kiptronic	http://www.kiptronic.com			null	advertising	20	2005	5	1	0	0	0		null	null	marketing@kiptronic.com	415-658-6855	Digital video ad platform	null	<p>Kiptronic offers a platform for dynamically inserting video and audio ads into digital media for consumption on any device (web pages, iPods, smartphones and laptops) online or offline. The company works with rich media content publishers to help them manage, measure and monetize their content. Major media companies and independent publishers no longer have to manually insert ads into their content – With Kiptronic, it happens on-the-fly, without altering existing publishing processes.</p><p>Key partnerships with rich media content delivery networks enable content publishers to turn on Kiptronic ad insertion as a simple add-on service to manage large ad campaigns through a robust ad operations tool. Kiptronic was recently named to the AlwaysOn Media 100 list of top media and advertising-related start-up companies for 2008. The company is backed by leading venture capital investors Blueprint Ventures (www.blueprintventures.com) and Prism VentureWorks (www.prismventure.com). </p>	$7.3M
